{
  "$schema": "https://json-schema.org/draft/2020-12/schema",
  "type": "object",
  "required": [
    "schema_version",
    "acceptance_id",
    "candidate_set_id",
    "decision",
    "state",
    "actor",
    "source_revision",
    "platform",
    "reviewed_at",
    "authorization_path",
    "authorization_sha256",
    "candidate_receipt_path",
    "candidate_receipt_sha256",
    "source_diff_path",
    "source_diff_sha256",
    "candidates"
  ],
  "properties": {
    "schema_version": { "const": 1 },
    "acceptance_id": { "type": "string", "pattern": "^[a-z0-9][a-z0-9._-]+$" },
    "candidate_set_id": { "type": "string", "pattern": "^[a-z0-9][a-z0-9._-]+$" },
    "decision": { "enum": ["accept_candidates", "reject_candidates"] },
    "state": { "enum": ["accepted", "rejected"] },
    "actor": {
      "type": "object",
      "required": ["id", "role"],
      "additionalProperties": false,
      "properties": {
        "id": { "type": "string", "minLength": 1 },
        "role": { "const": "code_reviewer" }
      }
    },
    "source_revision": { "type": "string", "pattern": "^[a-f0-9]{40}$" },
    "platform": { "enum": ["win32", "linux"] },
    "reviewed_at": {
      "type": "string",
      "pattern": "^\\d{4}-\\d{2}-\\d{2}T\\d{2}:\\d{2}:\\d{2}(?:\\.\\d{3})?Z$"
    },
    "authorization_path": { "type": "string" },
    "authorization_sha256": { "type": "string", "pattern": "^[a-f0-9]{64}$" },
    "candidate_receipt_path": { "type": "string" },
    "candidate_receipt_sha256": { "type": "string", "pattern": "^[a-f0-9]{64}$" },
    "source_diff_path": { "type": "string" },
    "source_diff_sha256": { "type": "string", "pattern": "^[a-f0-9]{64}$" },
    "candidates": {
      "type": "array",
      "minItems": 6,
      "maxItems": 6,
      "items": {
        "type": "object",
        "required": ["scenario_id", "path", "sha256"],
        "additionalProperties": false,
        "properties": {
          "scenario_id": { "type": "string" },
          "path": { "type": "string" },
          "sha256": { "type": "string", "pattern": "^[a-f0-9]{64}$" }
        }
      }
    }
  },
  "additionalProperties": false
}
