{
  "schema_version": 1,
  "acceptance_id": "accept-305e5846c9f5877a3758bd462747e94f-20260824",
  "candidate_set_id": "305e5846c9f5877a3758bd462747e94f",
  "decision": "accept_candidates",
  "state": "accepted",
  "actor": {
    "id": "workspace-code-reviewer",
    "role": "code_reviewer"
  },
  "source_revision": "71280172e6ae181d23ab0aea11bbcd14411cf8c8",
  "platform": "win32",
  "reviewed_at": "2026-08-24T07:01:32.931Z",
  "authorization_path": "apps/dashboard-e2e/visual-review/authorizations/win32-stable-six-7128017-20260824.json",
  "authorization_sha256": "bac944f947f34018a56738f617a2ed5807f96f3f157132b09f92ca72a58f520b",
  "candidate_receipt_path": "apps/dashboard-e2e/visual-review/candidate-sets/305e5846c9f5877a3758bd462747e94f.json",
  "candidate_receipt_sha256": "a41f8dd13dafd9ea62dbc0b22fda8d6df47a5e9a38736cc9e5ef26ef65dc4979",
  "source_diff_path": "apps/dashboard-e2e/visual-review/diffs/305e5846c9f5877a3758bd462747e94f.patch",
  "source_diff_sha256": "5f12b4e53dfb7f2c8bc682109dfe3f44ba683c9b5e57964a8496d5d87d81238b",
  "candidates": [
    {
      "scenario_id": "landing",
      "path": "apps/dashboard-e2e/src/quality/snapshots/win32/chromium/landing.png",
      "sha256": "837a123fe5a4ba97ea43b6a95fa29c4a6fccfb9008a25596b7682da872720ec2"
    },
    {
      "scenario_id": "ticker-desktop",
      "path": "apps/dashboard-e2e/src/quality/snapshots/win32/chromium/ticker-desktop.png",
      "sha256": "e160356c603dc36e180425f43694abf89afeb053e2e5d13c2cbd41647541c1eb"
    },
    {
      "scenario_id": "ticker-offline-mobile",
      "path": "apps/dashboard-e2e/src/quality/snapshots/win32/chromium/ticker-offline-mobile.png",
      "sha256": "eb365fd9945f3d03a713ea51a15a1ba44e4aaf26b191ddf5ff8db02c8c18f175"
    },
    {
      "scenario_id": "positions-dense",
      "path": "apps/dashboard-e2e/src/quality/snapshots/win32/chromium/positions-dense.png",
      "sha256": "4303acfe56911757d530588ee2d576bdcdf2db6f901b7ed5a93f3417b8b07bf8"
    },
    {
      "scenario_id": "scanner-dense",
      "path": "apps/dashboard-e2e/src/quality/snapshots/win32/chromium/scanner-dense.png",
      "sha256": "25d10e356ccf073a9e383967047d13d6714c35f2e707d9149cbd2b20baf32f0b"
    },
    {
      "scenario_id": "ai-recommendation",
      "path": "apps/dashboard-e2e/src/quality/snapshots/win32/chromium/ai-recommendation.png",
      "sha256": "88b2383ead4165f43618c6f416603707d63f96927e2866254e87bdbe3974dbb7"
    }
  ]
}
