{
  "schema_version": 1,
  "acceptance_id": "accept-6ee078b9e37d1c2f758749d76fea9931-20260909",
  "candidate_set_id": "6ee078b9e37d1c2f758749d76fea9931",
  "decision": "accept_candidates",
  "state": "accepted",
  "actor": {
    "id": "workspace-code-reviewer",
    "role": "code_reviewer"
  },
  "source_revision": "40ec63fc4e9ed6fc62790b1718b95d0064c5740e",
  "platform": "win32",
  "reviewed_at": "2026-09-09T00:34:29.079Z",
  "authorization_path": "apps/dashboard-e2e/visual-review/authorizations/win32-curvature-v2-40ec63f-20260908.json",
  "authorization_sha256": "cfa10f62e10fe744c0d5edf9699fb80043e6b5eccb55cc0a7d8faed1cb669d30",
  "candidate_receipt_path": "apps/dashboard-e2e/visual-review/candidate-sets/6ee078b9e37d1c2f758749d76fea9931.json",
  "candidate_receipt_sha256": "c07319987c13af4847e68fb12f02e75b1aa2bdbc7272576b24086bb28efc36f2",
  "source_diff_path": "apps/dashboard-e2e/visual-review/diffs/6ee078b9e37d1c2f758749d76fea9931.patch",
  "source_diff_sha256": "e2e69c87aa435cc7c6bdb357ebca4181f6c77a65a8ddab11fa31ecc263f64a64",
  "candidates": [
    {
      "scenario_id": "landing",
      "path": "apps/dashboard-e2e/src/quality/snapshots/win32/chromium/landing.png",
      "sha256": "dcd5af69caaab82f2d9e06165cf268aec82b43a52cd7578d92c6380558f6c2e8"
    },
    {
      "scenario_id": "ticker-desktop",
      "path": "apps/dashboard-e2e/src/quality/snapshots/win32/chromium/ticker-desktop.png",
      "sha256": "1c67d05182e52b711acf49f9aae97fc7f089efb6b922e680ddef2a54bfd34a30"
    },
    {
      "scenario_id": "ticker-offline-mobile",
      "path": "apps/dashboard-e2e/src/quality/snapshots/win32/chromium/ticker-offline-mobile.png",
      "sha256": "9bcb7e46ebb6056b4310972045f60a2766956fcc9298e560138879b6ded5af75"
    },
    {
      "scenario_id": "positions-dense",
      "path": "apps/dashboard-e2e/src/quality/snapshots/win32/chromium/positions-dense.png",
      "sha256": "59ba1436fb3d7d5c38e7f671c3290137ac13ce8722bd2f556e58d2ac42f8c750"
    },
    {
      "scenario_id": "scanner-dense",
      "path": "apps/dashboard-e2e/src/quality/snapshots/win32/chromium/scanner-dense.png",
      "sha256": "dcd1ca53541dadfb34dca632252eb00d020a518fd74f2e3c241fb356de9074c8"
    },
    {
      "scenario_id": "ai-recommendation",
      "path": "apps/dashboard-e2e/src/quality/snapshots/win32/chromium/ai-recommendation.png",
      "sha256": "abe4f38480153d8189e8c7ebe286c9874b81921dd2e8bfb0b7305a1c43040a48"
    }
  ]
}
