{
  "schema_version": 1,
  "acceptance_id": "44894ccd5fa8e8e986c66bd3e6c4841d",
  "candidate_set_id": "44894ccd5fa8e8e986c66bd3e6c4841d",
  "decision": "accept_candidates",
  "state": "accepted",
  "actor": {
    "id": "codex-independent-linux-visual-review",
    "role": "code_reviewer"
  },
  "source_revision": "219d73a67b6f7a284172afaa3fc24b1b850e3319",
  "platform": "linux",
  "reviewed_at": "2026-10-08T06:14:36.029Z",
  "authorization_path": "apps/dashboard-e2e/visual-review/authorizations/linux-portfolio-demo-219d73a-20261008.json",
  "authorization_sha256": "f6fd681fdf0bd8377c748c8b1bbabae0964ab9051e408726e2ce46878acaf319",
  "candidate_receipt_path": "apps/dashboard-e2e/visual-review/candidate-sets/44894ccd5fa8e8e986c66bd3e6c4841d.json",
  "candidate_receipt_sha256": "5ec830133daaa2d12678edd56a0207b4b05a6b954dccc63b8442f4c03238125f",
  "source_diff_path": "apps/dashboard-e2e/visual-review/diffs/44894ccd5fa8e8e986c66bd3e6c4841d.patch",
  "source_diff_sha256": "16a9d640de6320d847dc3d20264c096f49ea0c8c5ee10c1924813ea853d10c7b",
  "candidates": [
    {
      "scenario_id": "landing",
      "path": "apps/dashboard-e2e/src/quality/snapshots/linux/chromium/landing.png",
      "sha256": "a869a171559a3fe5e04917324acf4a2f4670d21fce3e7f4bf59168e0f5c756ea"
    },
    {
      "scenario_id": "ticker-desktop",
      "path": "apps/dashboard-e2e/src/quality/snapshots/linux/chromium/ticker-desktop.png",
      "sha256": "e6e349644c56754be53e27dd366e6b00eac2e670c2b90d1d4751a31df22c7c5e"
    },
    {
      "scenario_id": "ticker-offline-mobile",
      "path": "apps/dashboard-e2e/src/quality/snapshots/linux/chromium/ticker-offline-mobile.png",
      "sha256": "ba238097ae20e42932a0dbbaf8c42ad60d1a0e9cd7f2952a99a07856abef54d5"
    },
    {
      "scenario_id": "positions-dense",
      "path": "apps/dashboard-e2e/src/quality/snapshots/linux/chromium/positions-dense.png",
      "sha256": "d7609f61da0624ed79c9c4e3b580ea291af6e355c406a16e31d7773c9675f687"
    },
    {
      "scenario_id": "scanner-dense",
      "path": "apps/dashboard-e2e/src/quality/snapshots/linux/chromium/scanner-dense.png",
      "sha256": "09d6edba6ccaff27c5fbc88b4fd46dc5985755c735ce0752c96ab3b08aff2e26"
    },
    {
      "scenario_id": "ai-recommendation",
      "path": "apps/dashboard-e2e/src/quality/snapshots/linux/chromium/ai-recommendation.png",
      "sha256": "1aa03cd82b712c913989dadcaa19e5f5f00e70fac253deb100fa5e80556139e4"
    }
  ]
}
