{
  "schema_version": 1,
  "acceptance_id": "accept-fe3e8ea657c1851e9a3c3aa11bd0ad01-20260909",
  "candidate_set_id": "fe3e8ea657c1851e9a3c3aa11bd0ad01",
  "decision": "accept_candidates",
  "state": "accepted",
  "actor": {
    "id": "workspace-code-reviewer",
    "role": "code_reviewer"
  },
  "source_revision": "40ec63fc4e9ed6fc62790b1718b95d0064c5740e",
  "platform": "linux",
  "reviewed_at": "2026-09-09T00:39:36.689Z",
  "authorization_path": "apps/dashboard-e2e/visual-review/authorizations/linux-curvature-v2-40ec63f-20260908.json",
  "authorization_sha256": "b25ced27a47b9813047777f26adc2a514e1348df43bd263813d07cf98a26fc1f",
  "candidate_receipt_path": "apps/dashboard-e2e/visual-review/candidate-sets/fe3e8ea657c1851e9a3c3aa11bd0ad01.json",
  "candidate_receipt_sha256": "25f83ae8f360e83a67d510dc1d18289d04f42fcf8fc24981f5d9ca9623c29c49",
  "source_diff_path": "apps/dashboard-e2e/visual-review/diffs/fe3e8ea657c1851e9a3c3aa11bd0ad01.patch",
  "source_diff_sha256": "5f31d92a9ee4f8bcfc5a307eb2ca2a4807c1f815e4e395419688506608ef1946",
  "candidates": [
    {
      "scenario_id": "landing",
      "path": "apps/dashboard-e2e/src/quality/snapshots/linux/chromium/landing.png",
      "sha256": "9ebe1f8ea05c2b2bced65abd5f145248e60c773af8b3d75d43e081debb13417b"
    },
    {
      "scenario_id": "ticker-desktop",
      "path": "apps/dashboard-e2e/src/quality/snapshots/linux/chromium/ticker-desktop.png",
      "sha256": "38b1203e29f170d3b85cdfbff6df473f1b80f156bf9a19ee1ef49c4b869df843"
    },
    {
      "scenario_id": "ticker-offline-mobile",
      "path": "apps/dashboard-e2e/src/quality/snapshots/linux/chromium/ticker-offline-mobile.png",
      "sha256": "24320682cfbb31d8f33dd836c74267d23953e30ea5ecdf00986294baf7cb9413"
    },
    {
      "scenario_id": "positions-dense",
      "path": "apps/dashboard-e2e/src/quality/snapshots/linux/chromium/positions-dense.png",
      "sha256": "3bb35b3addd8e36f426fc9c6bd069efe744b8431b90cb1def1a262bf2afd9bd3"
    },
    {
      "scenario_id": "scanner-dense",
      "path": "apps/dashboard-e2e/src/quality/snapshots/linux/chromium/scanner-dense.png",
      "sha256": "e588b7273237946277e98382d2b422d4af767e1220ce180d742dfd2774f1c8de"
    },
    {
      "scenario_id": "ai-recommendation",
      "path": "apps/dashboard-e2e/src/quality/snapshots/linux/chromium/ai-recommendation.png",
      "sha256": "cf50b7f14bfe3bec9c40e3d040baeb8efc07b1e5cde78f00dcf4b4ace315d03b"
    }
  ]
}
