{
  "schema_version": 1,
  "acceptance_id": "68f647210293cad6724475d0a75932f4",
  "candidate_set_id": "68f647210293cad6724475d0a75932f4",
  "decision": "accept_candidates",
  "state": "accepted",
  "actor": {
    "id": "codex-independent-visual-review",
    "role": "code_reviewer"
  },
  "source_revision": "4c4fb35814a79de16f0d069f34a4f4d7b7797cd5",
  "platform": "win32",
  "reviewed_at": "2026-10-08T05:04:49.053Z",
  "authorization_path": "apps/dashboard-e2e/visual-review/authorizations/win32-portfolio-demo-4c4fb35-20261008.json",
  "authorization_sha256": "db714ec7d483b0e821c8fa8f16995828bb355c579b702a8141cb8f285ed76f39",
  "candidate_receipt_path": "apps/dashboard-e2e/visual-review/candidate-sets/68f647210293cad6724475d0a75932f4.json",
  "candidate_receipt_sha256": "f555dd6ef65150f9e5b15b67307a093136a7e15d9dea09dca2738cfc5fde2c5d",
  "source_diff_path": "apps/dashboard-e2e/visual-review/diffs/68f647210293cad6724475d0a75932f4.patch",
  "source_diff_sha256": "f37efbc5c2d4845298c98db716fb0eccfe82a875403ea7e6a2b3aa13612a03da",
  "candidates": [
    {
      "scenario_id": "landing",
      "path": "apps/dashboard-e2e/src/quality/snapshots/win32/chromium/landing.png",
      "sha256": "a752e719ad0105f586e6128c3fa0bd2796c8a6f19fac96bdcef57a00dac37b20"
    },
    {
      "scenario_id": "ticker-desktop",
      "path": "apps/dashboard-e2e/src/quality/snapshots/win32/chromium/ticker-desktop.png",
      "sha256": "45585eac999e830a8ae216c685b944548a366be9b8fa7cb0b16625755076a08c"
    },
    {
      "scenario_id": "ticker-offline-mobile",
      "path": "apps/dashboard-e2e/src/quality/snapshots/win32/chromium/ticker-offline-mobile.png",
      "sha256": "ff0d087507b5ca4a19e67e55362167e187992c9576635b634cbfa913f93d3079"
    },
    {
      "scenario_id": "positions-dense",
      "path": "apps/dashboard-e2e/src/quality/snapshots/win32/chromium/positions-dense.png",
      "sha256": "d39d97f4e7976496650177a7e997857f9c6bc08906d6f9af2733996544054211"
    },
    {
      "scenario_id": "scanner-dense",
      "path": "apps/dashboard-e2e/src/quality/snapshots/win32/chromium/scanner-dense.png",
      "sha256": "08650895f9f62657d58d46f017809b2595e2579db455630e9c732e5766b33d80"
    },
    {
      "scenario_id": "ai-recommendation",
      "path": "apps/dashboard-e2e/src/quality/snapshots/win32/chromium/ai-recommendation.png",
      "sha256": "f84bace1d768caf1b2fae062b1d93e2a46d93c57e3bb88cbdd99bfdff7940737"
    }
  ]
}
